{
  "version": 1,
  "split": "dev",
  "images": [
    "t9_parameters.jpg"
  ],
  "context": [],
  "questions": [
    "板書の式と、各文字の意味を短く教えて。"
  ],
  "suggestionAnchors": [
    "横移動",
    "s"
  ],
  "rubric": {
    "grounding": "資料にある内容と、計算・訂正・補足を明確に区別する。",
    "correctness": "y=p h(qx+r)+sを根拠にpは縦倍率と反転、qは横倍率(絶対値の逆数)、rは横移動に関係、sは縦移動。sの説明ラベルがないことと式にsがないことを混同せず、sも説明する。横移動量を言うならq≠0で-r/q。",
    "task_completion": "質問の対象へ具体的に答え、必要な理由を示す。",
    "uncertainty": "読める箇所を省かず、読めない箇所の内容は作らない。"
  },
  "id": "dev-parameter-coverage",
  "familyId": "function-transformations",
  "tags": [
    "blackboard",
    "task-completion",
    "variation"
  ]
}
